<?xml version='1.0' encoding='UTF-8'?>
<MemberUpdate xmlns:xsi="http://www.w3.org/2001/XMLSchema-instance" xsi:schemaLocation="http://www.kpei.co.id/middleware file:/C:/WORK/DEVELOPMENT/ARIS-KPEI-PROJECT/OR01-ARMSMember/xsd/ARMSMember-request.xsd" xmlns="http://www.kpei.co.id/middleware">
   <header id="id118">
      <asAt>2010-08-20T10:42:48.228</asAt>
      <source>source119</source>
   </header>
   <type>type120</type>
   <body>
      <riskPointDomain>
         <record id="id121">
            <parents>
               <parent id="KPEI_GRP"/>
            </parents>
            <fields>
               <field id="SERVICESERVER">string122</field>
               <field>string123</field>
               <field>string124</field>
            </fields>
         </record>
         <record id="id126">
            <fields>
               <field>string127</field>
               <field>string128</field>
               <field>string129</field>
               <field>string130</field>
            </fields>
         </record>
         <record id="id131">
            <parents>
               <parent/>
            </parents>
            <fields>
               <field>string132</field>
               <field>string133</field>
               <field>string134</field>
               <field>string135</field>
            </fields>
         </record>
      </riskPointDomain>
   </body>
   <ext>
      <value id="id136">string137</value>
      <value id="id138">string139</value>
      <value id="id140">string141</value>
   </ext>
</MemberUpdate>
