<?xml version='1.0' encoding='UTF-8'?>
<MemberUpdate xmlns:xsi="http://www.w3.org/2001/XMLSchema-instance" xsi:schemaLocation="http://www.kpei.co.id/schema/Member.001 file:/C:/WORK/DEVELOPMENT/ARIS-KPEI-PROJECT/OR01-ARMSMember/xsd/ARMSMember-request.xsd" xmlns="http://www.kpei.co.id/schema/Member.001">
   <header id="id31">
      <asAt>2010-08-23T07:30:54.430</asAt>
      <source>source32</source>
   </header>
   <type>type33</type>
   <body>
      <riskPointDomain>
         <record id="id34">
            <fields>
               <field>string35</field>
               <field>string36</field>
               <field>string37</field>
            </fields>
         </record>
         <record id="id38">
            <parents>
               <parent id="test"/>
            </parents>
            <fields>
               <field>string39</field>
               <field>string40</field>
               <field>string41</field>
            </fields>
         </record>
         <record id="id42">
            <fields>
               <field>string43</field>
               <field>string44</field>
               <field>string45</field>
            </fields>
         </record>
      </riskPointDomain>
   </body>
   <ext>
      <value id="id46">string47</value>
      <value id="id48">string49</value>
      <value id="id50">string51</value>
   </ext>
</MemberUpdate>
